{
  "novel_id": "660e8400-e29b-41d4-a716-446655440001",
  "clean_text": "深秋的夜风吹过江城的街道，苏念裹紧了身上单薄的外套，站在顾氏集团大厦的楼下。她的手里捏着一份刚打印出来的合同...",
  "word_count": 2300,
  "chapter_list": ["第1章 意外的相遇", "第2章 刻意接近"],
  "paragraph_list": [
    "深秋的夜风吹过江城的街道，苏念裹紧了身上单薄的外套。",
    "她站在顾氏集团大厦的楼下，手里捏着一份刚打印出来的合同。"
  ],
  "text_chunks": [
    {"chunk_index": 0, "text": "深秋的夜风吹过江城的街道，苏念裹紧了身上单薄的外套，站在顾氏集团大厦的楼下。"},
    {"chunk_index": 1, "text": "她的手里捏着一份刚打印出来的合同..."}
  ]
}
